{
  "scenario": "suite-v1",
  "company": "sharma",
  "month": "2026-06",
  "clean": true,
  "planted": [],
  "expected": [
    {
      "type": "gstr2b_wrong_period",
      "keys": {
        "invoice_no_norm": "OMK2026608",
        "supplier_gstin": "29AANCO3763Y1ZY"
      }
    },
    {
      "type": "gstr2b_wrong_period",
      "keys": {
        "invoice_no_norm": "SWF2026657",
        "supplier_gstin": "29PHGCS2431D1ZS"
      }
    },
    {
      "type": "gstr2b_wrong_period",
      "keys": {
        "invoice_no_norm": "KVR2026602",
        "supplier_gstin": "29ORXCK6371L1Z3"
      }
    }
  ],
  "investigations": [
    {
      "id": "X01",
      "keys": {
        "bank_txn_id": "BNK-20260609-001"
      },
      "expected_resolution": "gateway_settlement"
    },
    {
      "id": "X02",
      "keys": {
        "bank_txn_id": "BNK-20260616-001"
      },
      "expected_resolution": "gateway_settlement"
    },
    {
      "id": "X03",
      "keys": {
        "bank_txn_id": "BNK-20260623-001"
      },
      "expected_resolution": "gateway_settlement"
    },
    {
      "id": "X04",
      "keys": {
        "bank_txn_id": "BNK-20260630-003"
      },
      "expected_resolution": "gateway_settlement"
    }
  ]
}
