{
  "scenario": "suite-skeleton",
  "company": "sharma",
  "month": "2026-08",
  "clean": true,
  "planted": [],
  "expected": [],
  "investigations": [
    {
      "id": "X01",
      "keys": {
        "bank_txn_id": "BNK-20260811-002"
      },
      "expected_resolution": "gateway_settlement"
    },
    {
      "id": "X02",
      "keys": {
        "bank_txn_id": "BNK-20260818-002"
      },
      "expected_resolution": "gateway_settlement"
    },
    {
      "id": "X03",
      "keys": {
        "bank_txn_id": "BNK-20260825-002"
      },
      "expected_resolution": "gateway_settlement"
    }
  ]
}
